### ISSUE TITLE
domoticz can't see Aqara wireless switch

### ISSUE THREAD

**Issue by Kheamu** [openwrt/packages#12259]
Hello!

Domoticz 4.9700-3_arm_cortex-a7_neon-vfpv4 don't work with Aqara wireless switch with 1 or 2 keys(manually try to add it - nothing). Tried this version of domoticz at two different routers(asus and Xiaomi 3g) with openwrt.
At the same time domoticz on RaspberryPi 3 correctly work with it.

**Comment by neheb** [comment]
domoticz is unmaintained currently.

**Comment by neheb** [comment]
@dwmw2 ping

**Comment by dwmw2** [comment]
Is there anything in the logs when you attempt to add it? Precisely what hardware type are you choosing from the 'Type' dropdown list when you add the hardware?

**Comment by dwmw2** [comment]
Also, are you sure you're comparing with 4.9700 elsewhere? I'd expect you to be using Domoticz 2020.2 elsewhere, which is what I'm running on OpenWRT locally.

**Comment by Kheamu** [comment]
Hello! Thank you for answer. Aqara wireless switch adds in domoticz only manual(in windows domoticz after switch clicked, it appear in the system, but not in domoticz openWRT). My domoticz was installed from openwrt repository (opkg install domoticz). Where may a download Domoticz v.2020.2? Sorry for my English.

**Comment by Kheamu** [comment]
OS Windows there is for comparison, everything works in it.

**Comment by dwmw2** [comment]
I'll build you one. What version of OpenWRT are you using, on what hardware?

**Comment by dwmw2** [comment]
You didn't say what version of Domoticz you are using on other platforms.

Also, please increase the loglevel:
```
uci set domoticz.@domoticz[0].loglevel=6
```
When you restart Domoticz you should get a lot more information in the logs (`logread -f`). What does it say when you try to add the switch?

**Comment by dwmw2** [comment]
Domoticz 2020.1 and supporting packages for OpenWRT 19.07 arm_cortex-a7_neon-vfpv4 at 
 http://david.woodhou.se/domoticz-19.07/

2020.2 is slightly harder to build on 19.07 and shouldn't make much difference.

**Comment by Kheamu** [comment]
Hello! Thank you for answer! I use Asus RT-AC58U router and OpenWRT 19.07.3. At windows i try to use latest version of domoticz - 2020.2.11995. For Openwrt version number 4.9700-3.

**Comment by Kheamu** [comment]
When i try to add switch log says nothing. In web interfece (when i try to add switch manually) there is "timeout" like if i don't press the switch.

**Comment by Kheamu** [comment]
Will try to install you version of domoticz. Thank you!

**Comment by Kheamu** [comment]
Can't enter web enterface of dmtcz (x.x.x.x:8080) In system logs:

Thu Jun 11 13:43:27 2020 daemon.info procd: Instance domoticz::instance1 s in a crash loop 6 crashes, 0 seconds since last crash

**Comment by dwmw2** [comment]
Can you log in via SSH and run domoticz manually? What does it say?

**Comment by Kheamu** [comment]
Sorry, i forget to install last .ipk from your repository. Test in process) Thank you!

**Comment by Kheamu** [comment]
2020-06-11 14:28:35.416 Status: Domoticz V2020.1 (c)2012-1969 GizMoCuz
2020-06-11 14:28:35.416 Status: Build Hash: 0, Date: 1969-12-31 19:00:00
2020-06-11 14:28:35.417 Status: Startup Path: /usr/share/domoticz/
2020-06-11 14:28:35.479 Status: PluginSystem: Failed dynamic library load, install the latest libpython3.x library that is available for your platform.
2020-06-11 14:28:35.500 Status: WebServer(HTTP) started on address: :: with port 8080
2020-06-11 14:28:35.508 Status: TCPServer: shared server started...
2020-06-11 14:28:35.509 Status: RxQueue: queue worker started...
2020-06-11 14:28:37.555 Status: XiaomiGateway (ID=2): Delaying worker startup...
2020-06-11 14:28:42.565 Status: XiaomiGateway (ID=2): Selected as main Gateway
2020-06-11 14:28:42.574 Status: NotificationSystem: thread started...
2020-06-11 14:28:42.575 Status: XiaomiGateway (ID=2): Worker started...
2020-06-11 14:28:42.582 Status: EventSystem: reset all events...
2020-06-11 14:28:42.583 Status: XiaomiGateway (ID=2): Using 192.168.31.220 for local IP address.
2020-06-11 14:28:42.592 Status: EventSystem: reset all device statuses...
2020-06-11 14:28:42.594 Status: EventSystem - Python: Failed dynamic library load, install the latest libpython3.x library that is available for your platform.
2020-06-11 14:28:42.595 Status: EventSystem: Started
2020-06-11 14:28:42.595 Status: EventSystem: Queue thread started...
2020-06-11 14:28:42.606 Status: XiaomiGateway: RGB Gateway Detected
2020-06-11 14:28:42.918 Status: XiaomiGateway (ID=2): unhandled model: , name: Xiaomi Switch

**Comment by dwmw2** [comment]
If you run Domoticz 2020.1 on a platform where this works, what do you see in the corresponding log output?

**Comment by dwmw2** [comment]
I also built a new package with the Xiaomi changes from 2020.2, at http://david.woodhou.se/domoticz-19.07/domoticz_2020.1-3_arm_cortex-a7_neon-vfpv4.ipk

**Comment by Kheamu** [comment]
2020-06-12 00:45:57.111 (G) Light/Switch () <----before i manually adde switch



2020-06-12 00:45:57.086 Status: XiaomiGateway: New Xiaomi Wireless Dual Wall Switch Found (158d0002cb179f)
2020-06-12 00:46:22.705 (G) Temp (Xiaomi Temperature)
2020-06-12 00:46:22.724 (G) Humidity (Xiaomi Humidity)
2020-06-12 00:46:22.147 Status: EventSystem: reset all device statuses...
2020-06-12 00:46:24.051 (G) General/kWh (Xiaomi Smart Plug Usage)
2020-06-12 00:46:42.597 (G) Light/Switch (Aqara wireless)
2020-06-12 00:46:44.624 (G) Light/Switch (Aqara wireless)  <--- After i manually added swich(name enter manually too).

**Comment by Kheamu** [comment]
Updated new version. Nothing changed.

But in first 5-10 seconds after command "service domoticz restart" if you manage to add manually at this time, it will appear, but after it doesn't work. (Error sending switch command, check device/hardware (idx=9) !   <---error in web interface after switching icon)

Log:
2020-06-11 15:12:59.096 Status: Domoticz V2020.1 (c)2012-1969 GizMoCuz
2020-06-11 15:12:59.097 Status: Build Hash: 0, Date: 1969-12-31 19:00:00
2020-06-11 15:12:59.097 Status: Startup Path: /usr/share/domoticz/
2020-06-11 15:12:59.160 Status: PluginSystem: Failed dynamic library load, install the latest libpython3.x library that is available for your platform.
2020-06-11 15:12:59.181 Status: WebServer(HTTP) started on address: :: with port 8080
2020-06-11 15:12:59.189 Status: TCPServer: shared server started...
2020-06-11 15:12:59.190 Status: RxQueue: queue worker started...
2020-06-11 15:13:01.234 Status: XiaomiGateway (ID=2): Delaying worker startup...
2020-06-11 15:13:05.186 Status: New sensors allowed for 5 minutes...
2020-06-11 15:13:06.245 Status: XiaomiGateway (ID=2): Selected as main Gateway
2020-06-11 15:13:06.251 Status: XiaomiGateway (ID=2): Worker started...
2020-06-11 15:13:06.254 Status: NotificationSystem: thread started...
2020-06-11 15:13:06.255 Status: XiaomiGateway (ID=2): Using 192.168.31.220 for local IP address.
2020-06-11 15:13:06.255 Status: EventSystem: reset all events...
2020-06-11 15:13:06.258 Status: EventSystem: reset all device statuses...
2020-06-11 15:13:06.260 Status: EventSystem - Python: Failed dynamic library load, install the latest libpython3.x library that is available for your platform.
2020-06-11 15:13:06.261 Status: EventSystem: Started
2020-06-11 15:13:06.261 Status: EventSystem: Queue thread started...
2020-06-11 15:13:06.325 Status: XiaomiGateway: RGB Gateway Detected
2020-06-11 15:13:06.629 Status: XiaomiGateway (ID=2): unhandled model: '', name: 'Unknown Xiaomi device'
2020-06-11 15:13:22.613 Status: EventSystem: reset all device statuses...
2020-06-11 15:13:26.116 Status: User: root initiated a switch command (9/Switch/Off)
2020-06-11 15:13:26.325 Status: XiaomiGateway: SendMessageToGateway failed on first attempt, will try again
2020-06-11 15:13:26.319 Error: XiaomiGateway: unable to write command - Invalid key
2020-06-11 15:13:26.599 Error: XiaomiGateway: unable to write command - Invalid key
2020-06-11 15:13:38.219 Status: New sensors allowed for 5 minutes...
2020-06-11 15:20:48.282 Status: User: root initiated a switch command (9/Switch/Off)
2020-06-11 15:20:48.447 Status: XiaomiGateway: SendMessageToGateway failed on first attempt, will try again
2020-06-11 15:20:48.446 Error: XiaomiGateway: unable to write command - Invalid key
2020-06-11 15:20:48.714 Error: XiaomiGateway: unable to write command - Invalid key

**Comment by dwmw2** [comment]
Try removing the hardware in Domoticz and then re-adding it?

**Comment by Kheamu** [comment]
Re-add it. Nothig.

2020-06-11 15:51:48.653 Status: XiaomiGateway (ID=2): unhandled model: '', name: 'Unknown Xiaomi device'

**Comment by Huupke** [comment]
Which switch model are you trying to add? It seems the gateway reports an empty model.

**Comment by Kheamu** [comment]
Huupke, model Aqara wireless switch. In windows domoticz it is defined as "2020-06-12 00:45:57.086 Status: XiaomiGateway: New Xiaomi Wireless Dual Wall Switch Found (158d0002cb179f)"

**Comment by Kheamu** [comment]
2020-06-11 15:12:59.160 Status: PluginSystem: Failed dynamic library load, install the latest libpython3.x library that is available for your platform.

Is it necessarily to install libpython for my ordinary system?

**Comment by Huupke** [comment]
Are you sure it's the same device that is not recognized on Windows but is the dual wireless switch on OpenWRT?
It probably has to do with the communication with the gateway. Are you able to use a packet sniffer?

**Comment by Kheamu** [comment]
Amendment: Xiaomi Aqara dual wireless switch is not recognized in OpenWRT, but simply and good work in windows domoticz and mihome. I'm sure 100%.
About sniffer - if you give brief instructions then I’ll figure it out.

**Comment by Kheamu** [comment]
Found an interesting feature. At different time(I can not set the frequency) i can add my switch in OpenWRT domoticz and can work with it. But only for about 10 seconds.

Log at this moment and after:

2020-06-12 13:27:50.421 Status: User: Admin initiated a switch command (9/Switch2 Guestroom/Off)
2020-06-12 13:27:53.842 Status: User: Admin initiated a switch command (9/Switch2 Guestroom/On)
2020-06-12 13:27:57.956 Status: User: Admin initiated a switch command (9/Switch2 Guestroom/Off)
2020-06-12 13:27:58.124 Status: XiaomiGateway: SendMessageToGateway failed on first attempt, will try again
2020-06-12 13:27:58.116 Error: XiaomiGateway: unable to write command - Invalid key
2020-06-12 13:27:58.397 Error: XiaomiGateway: unable to write command - Invalid key
2020-06-12 13:28:01.886 Status: User: Admin initiated a switch command (9/Switch2 Guestroom/Off)
2020-06-12 13:28:02.054 Status: XiaomiGateway: SendMessageToGateway failed on first attempt, will try again
2020-06-12 13:28:02.051 Error: XiaomiGateway: unable to write command - Invalid key
2020-06-12 13:28:02.325 Error: XiaomiGateway: unable to write command - Invalid key
2020-06-12 13:28:21.846 Status: User: Admin initiated a switch command (9/Switch2 Guestroom/Off)
2020-06-12 13:28:22.014 Status: XiaomiGateway: SendMessageToGateway failed on first attempt, will try again
2020-06-12 13:28:22.014 Error: XiaomiGateway: unable to write command - Invalid key
2020-06-12 13:28:22.290 Error: XiaomiGateway: unable to write command - Invalid key

**Comment by Huupke** [comment]
You can use tcpdump, TShark or Wireshark. Start recording before you reboot Domoticz. After Domoticz has started stop the capture and share it

**Comment by Kheamu** [comment]
No.	Time	Source	Destination	Protocol	Length	Info
1	0.000000	ASUSTekC_56:06:38	Broadcast	ARP	60	Who has 192.168.31.165? Tell 192.168.31.1
2	0.066788	ASUSTekC_56:06:38	Broadcast	ARP	60	Who has 192.168.31.1? Tell 192.168.31.220
3	0.186669	ASUSTekC_56:06:38	Broadcast	ARP	60	Who has 192.168.31.116? Tell 192.168.31.220
4	0.283135	ASUSTekC_56:06:38	Broadcast	ARP	60	Gratuitous ARP for 192.168.31.116 (Request)
5	0.283458	ASUSTekC_56:06:38	Broadcast	ARP	60	Gratuitous ARP for 192.168.31.116 (Reply)
6	0.882669	192.168.31.222	192.168.31.220	SSH	118	Client: Encrypted packet (len=64)
7	0.894200	192.168.31.220	192.168.31.222	SSH	118	Server: Encrypted packet (len=64)
8	0.939538	192.168.31.222	192.168.31.220	TCP	54	59040 → 22 [ACK] Seq=65 Ack=65 Win=1025 Len=0
9	1.070046	192.168.31.220	192.168.31.222	SSH	150	Server: Encrypted packet (len=96)
10	1.075543	ASUSTekC_56:06:38	Broadcast	ARP	60	Who has 192.168.31.1? Tell 192.168.31.220
11	1.111415	192.168.31.222	192.168.31.220	TCP	54	59040 → 22 [ACK] Seq=65 Ack=161 Win=1025 Len=0
12	2.002305	ASUSTekC_56:06:38	Broadcast	ARP	60	Who has 192.168.31.165? Tell 192.168.31.1
13	2.086707	ASUSTekC_56:06:38	Broadcast	ARP	60	Who has 192.168.31.1? Tell 192.168.31.220
14	2.365961	192.168.31.220	224.0.0.22	IGMPv3	60	Membership Report / Leave group 224.0.0.50
15	2.546773	ASUSTekC_56:06:38	Broadcast	ARP	60	Who has 192.168.31.160? Tell 192.168.31.220
16	2.550099	ASUSTekC_56:06:38	Broadcast	ARP	60	Gratuitous ARP for 192.168.31.160 (Request)
17	2.550411	ASUSTekC_56:06:38	Broadcast	ARP	60	Gratuitous ARP for 192.168.31.160 (Reply)
18	3.235424	192.168.31.220	224.0.0.22	IGMPv3	60	Membership Report / Leave group 224.0.0.50
19	4.011684	ASUSTekC_56:06:38	Broadcast	ARP	60	Who has 192.168.31.165? Tell 192.168.31.1
20	4.576682	ASUSTekC_56:06:38	Broadcast	ARP	60	Who has 192.168.31.158? Tell 192.168.31.220
21	4.731826	ASUSTekC_56:06:38	Broadcast	ARP	60	Gratuitous ARP for 192.168.31.158 (Request)
22	4.732154	ASUSTekC_56:06:38	Broadcast	ARP	60	Gratuitous ARP for 192.168.31.158 (Reply)
23	4.866345	192.168.31.174	224.0.0.50	UDP	179	4321 → 9898 Len=137
24	5.546708	ASUSTekC_56:06:38	Broadcast	ARP	60	Who has 192.168.31.122? Tell 192.168.31.220
25	5.594804	ASUSTekC_56:06:38	Broadcast	ARP	60	Gratuitous ARP for 192.168.31.122 (Request)
26	5.595131	ASUSTekC_56:06:38	Broadcast	ARP	60	Gratuitous ARP for 192.168.31.122 (Reply)
27	6.054721	ASUSTekC_56:06:38	Broadcast	ARP	60	Who has 192.168.31.165? Tell 192.168.31.1
28	6.095796	192.168.31.222	192.168.31.1	NBSS	55	NBSS Continuation Message
29	6.101241	192.168.31.1	192.168.31.222	TCP	66	445 → 49668 [ACK] Seq=1 Ack=2 Win=691 Len=0 SLE=1 SRE=2
30	7.395763	ASUSTekC_56:06:38	IPv4mcast_16	ARP	60	Who has 224.0.0.22? Tell 192.168.31.220
31	8.060143	ASUSTekC_56:06:38	Broadcast	ARP	60	Who has 192.168.31.165? Tell 192.168.31.1
32	8.435779	ASUSTekC_56:06:38	IPv4mcast_16	ARP	60	Who has 224.0.0.22? Tell 192.168.31.220
33	9.475738	ASUSTekC_56:06:38	IPv4mcast_16	ARP	60	Who has 224.0.0.22? Tell 192.168.31.220
34	9.720897	ASUSTekC_56:06:38	Broadcast	ARP	60	Gratuitous ARP for 192.168.31.1 (Request)
35	9.721240	ASUSTekC_56:06:38	Broadcast	ARP	60	Gratuitous ARP for 192.168.31.1 (Reply)
36	9.945353	192.168.31.220	224.0.0.22	IGMPv3	60	Membership Report / Join group 224.0.0.50 for any sources
37	10.004142	ASUSTekC_56:06:38	Broadcast	ARP	60	Who has 192.168.31.101? Tell 192.168.31.174
38	10.064224	ASUSTekC_56:06:38	Broadcast	ARP	60	Who has 192.168.31.165? Tell 192.168.31.1
39	10.836271	ASUSTekC_56:06:38	Broadcast	ARP	60	Who has 224.0.0.22? Tell 192.168.31.220
40	10.886291	ASUSTekC_56:06:38	Broadcast	ARP	60	ARP Announcement for 192.168.31.160
41	11.875768	ASUSTekC_56:06:38	Broadcast	ARP	60	Who has 224.0.0.22? Tell 192.168.31.220
42	12.068185	ASUSTekC_56:06:38	Broadcast	ARP	60	Who has 192.168.31.165? Tell 192.168.31.1
43	12.120191	ASUSTekC_56:06:38	Broadcast	ARP	60	Who has 192.168.31.222? Tell 192.168.31.1
44	12.120218	ASUSTekC_9c:6d:86	ASUSTekC_56:06:38	ARP	42	192.168.31.222 is at 74:d0:2b:9c:6d:86
45	12.915715	ASUSTekC_56:06:38	Broadcast	ARP	60	Who has 224.0.0.22? Tell 192.168.31.220
46	14.118127	ASUSTekC_56:06:38	Broadcast	ARP	60	Who has 192.168.31.165? Tell 192.168.31.1
47	14.764400	192.168.31.174	224.0.0.50	UDP	154	4321 → 9898 Len=112
48	14.774495	192.168.31.174	224.0.0.50	UDP	151	4321 → 9898 Len=109
49	14.826462	192.168.31.174	224.0.0.50	UDP	152	4321 → 9898 Len=110
50	14.847791	192.168.31.174	224.0.0.50	UDP	179	4321 → 9898 Len=137
51	15.080730	ASUSTekC_56:06:38	Broadcast	ARP	60	Gratuitous ARP for 192.168.31.174 (Request)
52	15.081050	ASUSTekC_56:06:38	Broadcast	ARP	60	Gratuitous ARP for 192.168.31.174 (Reply)
53	16.120071	ASUSTekC_56:06:38	Broadcast	ARP	60	Who has 192.168.31.165? Tell 192.168.31.1
54	18.124401	ASUSTekC_56:06:38	Broadcast	ARP	60	Who has 192.168.31.165? Tell 192.168.31.1
55	20.129231	ASUSTekC_56:06:38	Broadcast	ARP	60	Who has 192.168.31.165? Tell 192.168.31.1
56	22.176275	ASUSTekC_56:06:38	Broadcast	ARP	60	Who has 192.168.31.165? Tell 192.168.31.1
57	22.352769	ASUSTekC_56:06:38	Broadcast	ARP	60	Who has 192.168.31.125? Tell 192.168.31.1
58	24.181012	ASUSTekC_56:06:38	Broadcast	ARP	60	Who has 192.168.31.165? Tell 192.168.31.1
59	24.356473	ASUSTekC_56:06:38	Broadcast	ARP	60	Who has 192.168.31.125? Tell 192.168.31.1
60	24.829058	192.168.31.174	224.0.0.50	UDP	179	4321 → 9898 Len=137
61	25.907213	ASUSTekC_56:06:38	Broadcast	ARP	60	ARP Announcement for 192.168.31.160
62	26.184038	ASUSTekC_56:06:38	Broadcast	ARP	60	Who has 192.168.31.165? Tell 192.168.31.1
63	26.360964	ASUSTekC_56:06:38	Broadcast	ARP	60	Who has 192.168.31.125? Tell 192.168.31.1
64	28.187886	ASUSTekC_56:06:38	Broadcast	ARP	60	Who has 192.168.31.165? Tell 192.168.31.1
65	28.363770	ASUSTekC_56:06:38	Broadcast	ARP	60	Who has 192.168.31.125? Tell 192.168.31.1
66	30.236869	ASUSTekC_56:06:38	Broadcast	ARP	60	Who has 192.168.31.165? Tell 192.168.31.1
67	30.287627	ASUSTekC_56:06:38	Broadcast	ARP	60	Who has 192.168.31.116? Tell 192.168.31.220
68	30.387961	ASUSTekC_56:06:38	Broadcast	ARP	60	Gratuitous ARP for 192.168.31.116 (Request)
69	30.388287	ASUSTekC_56:06:38	Broadcast	ARP	60	Gratuitous ARP for 192.168.31.116 (Reply)
70	32.240261	ASUSTekC_56:06:38	Broadcast	ARP	60	Who has 192.168.31.165? Tell 192.168.31.1
71	32.556555	ASUSTekC_56:06:38	Broadcast	ARP	60	Who has 192.168.31.160? Tell 192.168.31.220
72	32.560044	ASUSTekC_56:06:38	Broadcast	ARP	60	Gratuitous ARP for 192.168.31.160 (Request)
73	32.560385	ASUSTekC_56:06:38	Broadcast	ARP	60	Gratuitous ARP for 192.168.31.160 (Reply)
74	34.245352	ASUSTekC_56:06:38	Broadcast	ARP	60	Who has 192.168.31.165? Tell 192.168.31.1
75	34.736286	ASUSTekC_56:06:38	Broadcast	ARP	60	Who has 192.168.31.158? Tell 192.168.31.220
76	34.779249	ASUSTekC_56:06:38	Broadcast	ARP	60	Gratuitous ARP for 192.168.31.158 (Request)
77	34.779572	ASUSTekC_56:06:38	Broadcast	ARP	60	Gratuitous ARP for 192.168.31.158 (Reply)
78	34.810556	192.168.31.174	224.0.0.50	UDP	179	4321 → 9898 Len=137
79	35.606276	ASUSTekC_56:06:38	Broadcast	ARP	60	Who has 192.168.31.122? Tell 192.168.31.220
80	35.738993	ASUSTekC_56:06:38	Broadcast	ARP	60	Gratuitous ARP for 192.168.31.122 (Request)
81	35.739318	ASUSTekC_56:06:38	Broadcast	ARP	60	Gratuitous ARP for 192.168.31.122 (Reply)
82	36.248477	ASUSTekC_56:06:38	Broadcast	ARP	60	Who has 192.168.31.165? Tell 192.168.31.1
83	38.295670	ASUSTekC_56:06:38	Broadcast	ARP	60	Who has 192.168.31.165? Tell 192.168.31.1
84	39.725618	ASUSTekC_56:06:38	Broadcast	ARP	60	Who has 192.168.31.1? Tell 192.168.31.220
85	40.300837	ASUSTekC_56:06:38	Broadcast	ARP	60	Who has 192.168.31.165? Tell 192.168.31.1
86	40.736146	ASUSTekC_56:06:38	Broadcast	ARP	60	Who has 192.168.31.1? Tell 192.168.31.220
87	40.928696	ASUSTekC_56:06:38	Broadcast	ARP	60	ARP Announcement for 192.168.31.160
88	41.746218	ASUSTekC_56:06:38	Broadcast	ARP	60	Who has 192.168.31.1? Tell 192.168.31.220
89	42.126091	ASUSTekC_56:06:38	Broadcast	ARP	60	Who has 192.168.31.222? Tell 192.168.31.220
90	42.126119	ASUSTekC_9c:6d:86	ASUSTekC_56:06:38	ARP	42	192.168.31.222 is at 74:d0:2b:9c:6d:86
91	42.302222	ASUSTekC_56:06:38	Broadcast	ARP	60	Who has 192.168.31.165? Tell 192.168.31.1
92	42.756103	ASUSTekC_56:06:38	Broadcast	ARP	60	Who has 192.168.31.1? Tell 192.168.31.220
93	43.766083	ASUSTekC_56:06:38	Broadcast	ARP	60	Who has 192.168.31.1? Tell 192.168.31.220
94	44.308008	ASUSTekC_56:06:38	Broadcast	ARP	60	Who has 192.168.31.165? Tell 192.168.31.1
95	44.792607	192.168.31.174	224.0.0.50	UDP	179	4321 → 9898 Len=137
96	45.086180	ASUSTekC_56:06:38	Broadcast	ARP	60	Who has 192.168.31.174? Tell 192.168.31.220
97	45.120020	ASUSTekC_56:06:38	Broadcast	ARP	60	Gratuitous ARP for 192.168.31.174 (Request)
98	45.120345	ASUSTekC_56:06:38	Broadcast	ARP	60	Gratuitous ARP for 192.168.31.174 (Reply)
99	46.356269	ASUSTekC_56:06:38	Broadcast	ARP	60	Who has 192.168.31.165? Tell 192.168.31.1
100	48.359970	ASUSTekC_56:06:38	Broadcast	ARP	60	Who has 192.168.31.165? Tell 192.168.31.1
101	49.741806	192.168.31.174	224.0.0.50	UDP	140	4321 → 9898 Len=98
102	50.364172	ASUSTekC_56:06:38	Broadcast	ARP	60	Who has 192.168.31.165? Tell 192.168.31.1
103	52.368150	ASUSTekC_56:06:38	Broadcast	ARP	60	Who has 192.168.31.165? Tell 192.168.31.1
104	54.415929	ASUSTekC_56:06:38	Broadcast	ARP	60	Who has 192.168.31.165? Tell 192.168.31.1
105	54.774915	192.168.31.174	224.0.0.50	UDP	179	4321 → 9898 Len=137
106	56.420125	ASUSTekC_56:06:38	Broadcast	ARP	60	Who has 192.168.31.165? Tell 192.168.31.1
107	56.590789	192.168.31.174	224.0.0.50	UDP	160	4321 → 9898 Len=118
108	57.798146	ASUSTekC_56:06:38	Broadcast	ARP	60	Gratuitous ARP for 192.168.31.1 (Request)
109	57.798479	ASUSTekC_56:06:38	Broadcast	ARP	60	Gratuitous ARP for 192.168.31.1 (Reply)
110	58.423946	ASUSTekC_56:06:38	Broadcast	ARP	60	Who has 192.168.31.165? Tell 192.168.31.1
111	59.218497	ASUSTekC_56:06:38	Broadcast	ARP	60	Who has 192.168.31.125? Tell 192.168.31.1
112	60.201414	192.168.31.174	224.0.0.50	UDP	160	4321 → 9898 Len=118
113	60.396188	ASUSTekC_56:06:38	Broadcast	ARP	60	Who has 192.168.31.116? Tell 192.168.31.220
114	60.427668	ASUSTekC_56:06:38	Broadcast	ARP	60	Who has 192.168.31.165? Tell 192.168.31.1
115	60.493916	ASUSTekC_56:06:38	Broadcast	ARP	60	Gratuitous ARP for 192.168.31.116 (Request)
116	60.494242	ASUSTekC_56:06:38	Broadcast	ARP	60	Gratuitous ARP for 192.168.31.116 (Reply)
117	61.114859	ASUSTekC_56:06:38	Broadcast	ARP	60	ARP Announcement for 192.168.31.160
118	61.224655	ASUSTekC_56:06:38	Broadcast	ARP	60	Who has 192.168.31.125? Tell 192.168.31.1
119	62.477512	ASUSTekC_56:06:38	Broadcast	ARP	60	Who has 192.168.31.165? Tell 192.168.31.1
120	62.567116	ASUSTekC_56:06:38	Broadcast	ARP	60	Who has 192.168.31.160? Tell 192.168.31.220
121	62.568685	ASUSTekC_56:06:38	Broadcast	ARP	60	Gratuitous ARP for 192.168.31.160 (Request)
122	62.569006	ASUSTekC_56:06:38	Broadcast	ARP	60	Gratuitous ARP for 192.168.31.160 (Reply)
123	63.227776	ASUSTekC_56:06:38	Broadcast	ARP	60	Who has 192.168.31.125? Tell 192.168.31.1
124	63.705999	192.168.31.174	224.0.0.50	UDP	160	4321 → 9898 Len=118
125	64.480015	ASUSTekC_56:06:38	Broadcast	ARP	60	Who has 192.168.31.165? Tell 192.168.31.1
126	64.753844	192.168.31.174	224.0.0.50	UDP	179	4321 → 9898 Len=137
127	64.785666	ASUSTekC_56:06:38	Broadcast	ARP	60	Who has 192.168.31.158? Tell 192.168.31.220
128	64.931438	ASUSTekC_56:06:38	Broadcast	ARP	60	Gratuitous ARP for 192.168.31.158 (Request)
129	64.931755	ASUSTekC_56:06:38	Broadcast	ARP	60	Gratuitous ARP for 192.168.31.158 (Reply)
130	65.231425	ASUSTekC_56:06:38	Broadcast	ARP	60	Who has 192.168.31.125? Tell 192.168.31.1
131	65.745761	ASUSTekC_56:06:38	Broadcast	ARP	60	Who has 192.168.31.122? Tell 192.168.31.220
132	65.805157	ASUSTekC_56:06:38	Broadcast	ARP	60	Gratuitous ARP for 192.168.31.122 (Request)
133	65.805271	ASUSTekC_56:06:38	Broadcast	ARP	60	Gratuitous ARP for 192.168.31.122 (Reply)
134	65.929019	192.168.31.174	224.0.0.50	UDP	168	4321 → 9898 Len=126
135	66.483567	ASUSTekC_56:06:38	Broadcast	ARP	60	Who has 192.168.31.165? Tell 192.168.31.1
136	68.487575	ASUSTekC_56:06:38	Broadcast	ARP	60	Who has 192.168.31.165? Tell 192.168.31.1
137	70.535671	ASUSTekC_56:06:38	Broadcast	ARP	60	Who has 192.168.31.165? Tell 192.168.31.1
138	72.135846	ASUSTekC_56:06:38	Broadcast	ARP	60	Who has 192.168.31.222? Tell 192.168.31.220
139	72.135869	ASUSTekC_9c:6d:86	ASUSTekC_56:06:38	ARP	42	192.168.31.222 is at 74:d0:2b:9c:6d:86
140	72.539182	ASUSTekC_56:06:38	Broadcast	ARP	60	Who has 192.168.31.165? Tell 192.168.31.1
141	73.446282	192.168.31.174	224.0.0.50	UDP	160	4321 → 9898 Len=118
142	74.307516	192.168.31.174	224.0.0.50	UDP	152	4321 → 9898 Len=110
143	74.543615	ASUSTekC_56:06:38	Broadcast	ARP	60	Who has 192.168.31.165? Tell 192.168.31.1
144	74.736830	192.168.31.174	224.0.0.50	UDP	179	4321 → 9898 Len=137
145	75.125538	ASUSTekC_56:06:38	Broadcast	ARP	60	Who has 192.168.31.174? Tell 192.168.31.220
146	75.226351	ASUSTekC_56:06:38	Broadcast	ARP	60	Gratuitous ARP for 192.168.31.174 (Request)
147	75.226676	ASUSTekC_56:06:38	Broadcast	ARP	60	Gratuitous ARP for 192.168.31.174 (Reply)
148	75.305391	192.168.31.174	224.0.0.50	UDP	152	4321 → 9898 Len=110
149	76.126480	ASUSTekC_56:06:38	Broadcast	ARP	60	ARP Announcement for 192.168.31.160
150	76.547785	ASUSTekC_56:06:38	Broadcast	ARP	60	Who has 192.168.31.165? Tell 192.168.31.1
151	78.595991	ASUSTekC_56:06:38	Broadcast	ARP	60	Who has 192.168.31.165? Tell 192.168.31.1
152	80.599119	ASUSTekC_56:06:38	Broadcast	ARP	60	Who has 192.168.31.165? Tell 192.168.31.1
153	81.125446	fe80::42b0:76ff:fe56:638	ff02::1	ICMPv6	174	Router Advertisement from 40:b0:76:56:06:38
154	81.573810	192.168.31.174	224.0.0.50	UDP	160	4321 → 9898 Len=118
155	82.293103	192.168.31.174	224.0.0.50	UDP	153	4321 → 9898 Len=111
156	82.604667	ASUSTekC_56:06:38	Broadcast	ARP	60	Who has 192.168.31.165? Tell 192.168.31.1
157	83.291963	192.168.31.174	224.0.0.50	UDP	153	4321 → 9898 Len=111
158	84.608270	ASUSTekC_56:06:38	Broadcast	ARP	60	Who has 192.168.31.165? Tell 192.168.31.1
159	84.717831	192.168.31.174	224.0.0.50	UDP	179	4321 → 9898 Len=137

**Comment by Kheamu** [comment]
Where 31.174 - Gateway Xiaomi
            31.220 - router Asus with OpenWRT and Domoticz
            31.222 - PC
            31.1 - second router with PPPoE internet.

**Comment by Huupke** [comment]
I need the actual content of the package comming from the gateway.

**Comment by Kheamu** [comment]
Set filter ip.addr==192.168.31.174  <--(Mi Gateway)

184	7.228367	192.168.31.174	224.0.0.50	UDP	179	4321 → 9898 Len=137
245	14.906297	192.168.31.174	224.0.0.50	UDP	154	4321 → 9898 Len=112
246	14.908213	192.168.31.174	224.0.0.50	UDP	151	4321 → 9898 Len=109
267	17.157515	192.168.31.174	224.0.0.50	UDP	179	4321 → 9898 Len=137
294	21.764642	192.168.31.174	224.0.0.50	UDP	152	4321 → 9898 Len=110
362	26.782371	192.168.31.174	224.0.0.50	UDP	152	4321 → 9898 Len=110
363	27.192105	192.168.31.174	224.0.0.50	UDP	179	4321 → 9898 Len=137
441	30.778905	192.168.31.174	224.0.0.50	UDP	152	4321 → 9898 Len=110
489	32.725723	192.168.31.174	224.0.0.50	UDP	234	4321 → 9898 Len=192
507	35.793561	192.168.31.174	224.0.0.50	UDP	152	4321 → 9898 Len=110
518	36.714847	192.168.31.174	224.0.0.50	UDP	152	4321 → 9898 Len=110
519	37.128071	192.168.31.174	224.0.0.50	UDP	179	4321 → 9898 Len=137
523	37.738988	192.168.31.174	224.0.0.50	UDP	152	4321 → 9898 Len=110
669	47.159783	192.168.31.174	224.0.0.50	UDP	179	4321 → 9898 Len=137
790	57.096088	192.168.31.174	224.0.0.50	UDP	179	4321 → 9898 Len=137
1021	67.129803	192.168.31.174	224.0.0.50	UDP	179	4321 → 9898 Len=137
1114	77.064558	192.168.31.174	224.0.0.50	UDP	179	4321 → 9898 Len=137
1127	80.137084	192.168.31.174	224.0.0.50	UDP	154	4321 → 9898 Len=112
1130	80.237655	192.168.31.174	224.0.0.50	UDP	151	4321 → 9898 Len=109
1131	80.239673	192.168.31.174	224.0.0.50	UDP	153	4321 → 9898 Len=111

Write command wia ssh service domoticz restart.....10sec.....service domoticz stop...10sec....service domoticz start/

**Comment by dwmw2** [comment]
To show the content of the packets try adding `-x` to the tcpdump command line.

Or `-w /tmp/capture.cap` and send us the resulting capture.cap file.

**Comment by Kheamu** [comment]
Use  tcpdump host 192.168.31.174 -x -w /tmp/capture.cap.
Then "service domoticz restart"...20sec..."service domoticz stop"...20sec..."service domoticz start".

1	0.000000	192.168.31.174	224.0.0.50	UDP	140	4321 → 9898 Len=98
2	4.403487	192.168.31.174	224.0.0.50	UDP	179	4321 → 9898 Len=137
3	14.337034	192.168.31.174	224.0.0.50	UDP	179	4321 → 9898 Len=137
4	19.077875	ASUSTekC_56:06:38	Broadcast	ARP	42	Who has 192.168.31.174? Tell 192.168.31.220
5	19.179311	ASUSTekC_56:06:38	Broadcast	ARP	42	Gratuitous ARP for 192.168.31.174 (Request)
6	19.179409	ASUSTekC_56:06:38	Broadcast	ARP	42	Gratuitous ARP for 192.168.31.174 (Reply)
7	24.370151	192.168.31.174	224.0.0.50	UDP	179	4321 → 9898 Len=137
8	34.302260	192.168.31.174	224.0.0.50	UDP	179	4321 → 9898 Len=137
9	36.455662	192.168.31.174	224.0.0.50	UDP	154	4321 → 9898 Len=112
10	36.457234	192.168.31.174	224.0.0.50	UDP	151	4321 → 9898 Len=109
11	36.458833	192.168.31.174	224.0.0.50	UDP	153	4321 → 9898 Len=111
12	43.213343	192.168.31.174	224.0.0.50	UDP	144	4321 → 9898 Len=102
13	43.214544	192.168.31.174	224.0.0.50	UDP	162	4321 → 9898 Len=120
14	44.337093	192.168.31.174	224.0.0.50	UDP	179	4321 → 9898 Len=137
15	49.189171	ASUSTekC_56:06:38	Broadcast	ARP	42	Who has 192.168.31.174? Tell 192.168.31.220
16	49.286667	ASUSTekC_56:06:38	Broadcast	ARP	42	Gratuitous ARP for 192.168.31.174 (Request)
17	49.288135	ASUSTekC_56:06:38	Broadcast	ARP	42	Gratuitous ARP for 192.168.31.174 (Reply)
18	53.247994	192.168.31.174	224.0.0.50	UDP	156	4321 → 9898 Len=114
19	54.173677	192.168.31.174	224.0.0.50	UDP	178	4321 → 9898 Len=136
20	54.273422	192.168.31.174	224.0.0.50	UDP	179	4321 → 9898 Len=137
21	64.202708	192.168.31.174	224.0.0.50	UDP	179	4321 → 9898 Len=137
22	74.238084	192.168.31.174	224.0.0.50	UDP	179	4321 → 9898 Len=137
23	77.002832	192.168.31.174	224.0.0.50	UDP	154	4321 → 9898 Len=112
24	77.003259	192.168.31.174	224.0.0.50	UDP	151	4321 → 9898 Len=109
25	77.109135	192.168.31.174	224.0.0.50	UDP	153	4321 → 9898 Len=111
26	79.289034	ASUSTekC_56:06:38	Broadcast	ARP	42	Who has 192.168.31.174? Tell 192.168.31.220
27	79.392494	ASUSTekC_56:06:38	Broadcast	ARP	42	Gratuitous ARP for 192.168.31.174 (Request)
28	79.393412	ASUSTekC_56:06:38	Broadcast	ARP	42	Gratuitous ARP for 192.168.31.174 (Reply)
29	84.174154	192.168.31.174	224.0.0.50	UDP	179	4321 → 9898 Len=137

Where 31.174 - Xiaomi gateway
           31.220-router with openwrt and domoticz.

**Comment by Kheamu** [comment]
How may i attach file capture.cap? It contains much more information.

**Comment by Kheamu** [comment]
[captureMI.txt](https://github.com/openwrt/packages/files/4776581/captureMI.txt)

**Comment by Kheamu** [comment]
[capture.zip](https://github.com/openwrt/packages/files/4776589/capture.zip)

**Comment by dwmw2** [comment]
There's only 1½ seconds of capture there. Can you capture the full time that Domoticz starts up until it sees (or fails to see) the offending device?

**Comment by Kheamu** [comment]
There is about 3 minutes of my active attemts to add switches in domoticz and restarting it
[capture.zip](https://github.com/openwrt/packages/files/4778137/capture.zip)

**Comment by Kheamu** [comment]
I did something wrong?

**Comment by GeorgeSapkin** [comment]
Closing as stale.
